{
  "$schema": "https://json-schema.org/draft/2019-09/schema",
  "$defs": {
    "string": {
      "type": "string",
      "minLength": 1
    }
  },
  "type": "object",
  "properties": {
    "message": {
      "type": "object",
      "properties": {
        "ConfirmDeleteTransaction": {
          "$ref": "#/$defs/string"
        },
        "ConfirmPlannedTransaction": {
          "$ref": "#/$defs/string"
        },
        "ConfirmSplitTransaction": {
          "$ref": "#/$defs/string"
        }
      },
      "required": [
        "ConfirmDeleteTransaction",
        "ConfirmPlannedTransaction",
        "ConfirmSplitTransaction"
      ]
    },
    "multiDelete": {
      "type": "object",
      "properties": {
        "confirm": {
          "type": "object",
          "properties": {
            "Content": {
              "$ref": "#/$defs/string"
            },
            "OK": {
              "$ref": "#/$defs/string"
            },
            "Title": {
              "$ref": "#/$defs/string"
            }
          },
          "required": ["Content", "OK", "Title"]
        }
      },
      "required": ["confirm"]
    },
    "page": {
      "type": "object",
      "properties": {
        "title": {
          "$ref": "#/$defs/string"
        }
      },
      "required": ["title"]
    },
    "table": {
      "type": "object",
      "properties": {
        "button": {
          "type": "object",
          "properties": {
            "ConfigureTable": {
              "$ref": "#/$defs/string"
            },
            "CreateCopy": {
              "$ref": "#/$defs/string"
            },
            "MoreTransactions": {
              "$ref": "#/$defs/string"
            },
            "ShowReceipt": {
              "$ref": "#/$defs/string"
            },
            "SplitTransfer": {
              "$ref": "#/$defs/string"
            }
          },
          "required": [
            "ConfigureTable",
            "CreateCopy",
            "MoreTransactions",
            "ShowReceipt",
            "SplitTransfer"
          ]
        },
        "content": {
          "type": "object",
          "properties": {
            "NothingWasFound": {
              "$ref": "#/$defs/string"
            }
          },
          "required": ["NothingWasFound"]
        },
        "filter": {
          "type": "object",
          "properties": {
            "account": {
              "type": "object",
              "properties": {
                "label": {
                  "type": "object",
                  "properties": {
                    "SelectAccount": {
                      "$ref": "#/$defs/string"
                    }
                  },
                  "required": ["SelectAccount"]
                }
              },
              "required": ["label"]
            },
            "amount": {
              "type": "object",
              "properties": {
                "label": {
                  "type": "object",
                  "properties": {
                    "Amount": {
                      "$ref": "#/$defs/string"
                    }
                  },
                  "required": ["Amount"]
                }
              },
              "required": ["label"]
            },
            "category": {
              "type": "object",
              "properties": {
                "label": {
                  "type": "object",
                  "properties": {
                    "SelectCategory": {
                      "$ref": "#/$defs/string"
                    }
                  },
                  "required": ["SelectCategory"]
                }
              },
              "required": ["label"]
            },
            "project": {
              "type": "object",
              "properties": {
                "label": {
                  "type": "object",
                  "properties": {
                    "SelectProject": {
                      "$ref": "#/$defs/string"
                    }
                  },
                  "required": ["SelectProject"]
                }
              },
              "required": ["label"]
            },
            "type": {
              "type": "object",
              "properties": {
                "label": {
                  "type": "object",
                  "properties": {
                    "Expenses": {
                      "$ref": "#/$defs/string"
                    },
                    "Incomes": {
                      "$ref": "#/$defs/string"
                    },
                    "Loans": {
                      "$ref": "#/$defs/string"
                    },
                    "Transfers": {
                      "$ref": "#/$defs/string"
                    }
                  },
                  "required": ["Expenses", "Incomes", "Loans", "Transfers"]
                }
              },
              "required": ["label"]
            },
            "user": {
              "type": "object",
              "properties": {
                "label": {
                  "type": "object",
                  "properties": {
                    "SelectUser": {
                      "$ref": "#/$defs/string"
                    },
                    "deleted": {
                      "$ref": "#/$defs/string"
                    },
                    "notInTeam": {
                      "$ref": "#/$defs/string"
                    }
                  },
                  "required": ["SelectUser", "deleted", "notInTeam"]
                }
              },
              "required": ["label"]
            }
          },
          "required": [
            "account",
            "amount",
            "category",
            "project",
            "type",
            "user"
          ]
        },
        "head": {
          "type": "object",
          "properties": {
            "config": {
              "type": "object",
              "properties": {
                "DisplayAdaptive": {
                  "$ref": "#/$defs/string"
                },
                "DisplayAlways": {
                  "$ref": "#/$defs/string"
                },
                "DisplayExtraColumns": {
                  "$ref": "#/$defs/string"
                },
                "DisplayNever": {
                  "$ref": "#/$defs/string"
                },
                "Title": {
                  "$ref": "#/$defs/string"
                }
              },
              "required": [
                "DisplayAdaptive",
                "DisplayAlways",
                "DisplayExtraColumns",
                "DisplayNever",
                "Title"
              ]
            },
            "label": {
              "type": "object",
              "properties": {
                "CategoryDescription": {
                  "$ref": "#/$defs/string"
                },
                "Remain": {
                  "$ref": "#/$defs/string"
                }
              },
              "required": ["CategoryDescription", "Remain"]
            }
          },
          "required": ["config", "label"]
        }
      },
      "required": ["button", "content", "filter", "head"]
    },
    "transferJoin": {
      "type": "object",
      "properties": {
        "button": {
          "type": "object",
          "properties": {
            "Join": {
              "$ref": "#/$defs/string"
            }
          },
          "required": ["Join"]
        },
        "message": {
          "type": "object",
          "properties": {
            "ChooseCommissionCategory": {
              "$ref": "#/$defs/string"
            },
            "ThisCanBeDoneWithCommission": {
              "$ref": "#/$defs/string"
            },
            "YouAreGoingToJoinWhat": {
              "$ref": "#/$defs/string"
            }
          },
          "required": [
            "ChooseCommissionCategory",
            "ThisCanBeDoneWithCommission",
            "YouAreGoingToJoinWhat"
          ]
        }
      },
      "required": ["button", "message"]
    },
    "unconfirmed": {
      "type": "object",
      "properties": {
        "EndTitle": {
          "$ref": "#/$defs/string"
        },
        "Title": {
          "$ref": "#/$defs/string"
        }
      },
      "required": ["EndTitle", "Title"]
    }
  },
  "required": [
    "message",
    "multiDelete",
    "page",
    "table",
    "transferJoin",
    "unconfirmed"
  ]
}
