{
  "message": {
    "ConfirmDeleteTransaction": "Are you sure to delete the transaction? This action cannot be undone.",
    "ConfirmPlannedTransaction": "Are you sure to confirm the transaction?",
    "ConfirmSplitTransaction": "Are you sure to split this transfer?"
  },
  "multiDelete": {
    "confirm": {
      "Content": "Are you sure to delete <1>{n, plural, one{# transaction} other{# transactions}}</1>? This action cannot be undone.",
      "OK": "Delete {n, plural, one{# transaction} other{# transactions}}",
      "Title": "Delete checked transactions"
    }
  },
  "page": {
    "title": "Transactions"
  },
  "table": {
    "button": {
      "ConfigureTable": "Configure table",
      "CreateCopy": "Create a copy",
      "MoreTransactions": "More transactions",
      "ShowReceipt": "Show receipt",
      "SplitTransfer": "Split transfer"
    },
    "content": {
      "NothingWasFound": "There are no transactions"
    },
    "filter": {
      "account": {
        "label": {
          "SelectAccount": "Select an account"
        }
      },
      "amount": {
        "label": {
          "Amount": "Provide an amount"
        }
      },
      "category": {
        "label": {
          "SelectCategory": "Select a category"
        }
      },
      "project": {
        "label": {
          "SelectProject": "Select a project"
        }
      },
      "type": {
        "label": {
          "Expenses": "Expenses",
          "Incomes": "Incomes",
          "Loans": "Loans",
          "Transfers": "Transfers"
        }
      },
      "user": {
        "label": {
          "deleted": "deleted",
          "notInTeam": "not in team",
          "SelectUser": "Select an user"
        }
      }
    },
    "head": {
      "config": {
        "DisplayAdaptive": "Adaptive",
        "DisplayAlways": "Always",
        "DisplayExtraColumns": "Choose conditions to display extra columns.",
        "DisplayNever": "Never",
        "Title": "Table configuration"
      },
      "label": {
        "CategoryDescription": "Category, Description",
        "Remain": "Remain"
      }
    }
  },
  "transferJoin": {
    "button": {
      "Join": "Join to transfer"
    },
    "message": {
      "ChooseCommissionCategory": "Please, choose a category for commission fee transaction:",
      "ThisCanBeDoneWithCommission": "This can be done by creating a commission fee transaction for <1>{sum}</1>.",
      "YouAreGoingToJoinWhat": "You are requested to join into a transfer two transactions with different amounts:"
    }
  },
  "unconfirmed": {
    "EndTitle": "Regular transactions",
    "Title": "Unconfirmed transactions"
  }
}
