{
  "message": {
    "ConfirmDeleteTransaction": "Určitě chcete transakci odstranit? Operace nelze stornovat",
    "ConfirmPlannedTransaction": "Určitě chcete transakci potvrdit?",
    "ConfirmSplitTransaction": "Určitě chcete tento převod rozdělit?"
  },
  "multiDelete": {
    "confirm": {
      "Content": "Jste si jisti, že chcete smazat <1>{n, plural, one{# transakci} few{# transakce} other{# transakcí}}</1>? Operace nelze stornovat",
      "OK": "Smazat {n, plural, one{# transakci} few{# transakce} other{# transakcí}}",
      "Title": "Odstranění označených transakcí"
    }
  },
  "page": {
    "title": "Transakce"
  },
  "table": {
    "button": {
      "ConfigureTable": "Přizpůsobit tabulku",
      "CreateCopy": "Vytvořte kopii",
      "MoreTransactions": "Další transakce",
      "ShowReceipt": "Zobrazit účtenku",
      "SplitTransfer": "Rozdělit převod"
    },
    "content": {
      "NothingWasFound": "Žádné transakce"
    },
    "filter": {
      "account": {
        "label": {
          "SelectAccount": "Zvolte účet"
        }
      },
      "amount": {
        "label": {
          "Amount": "Uveďte částku"
        }
      },
      "category": {
        "label": {
          "SelectCategory": "Vyberte kategorii"
        }
      },
      "project": {
        "label": {
          "SelectProject": "Vyberte projekt"
        }
      },
      "type": {
        "label": {
          "Expenses": "Výdaje",
          "Incomes": "Příjmy",
          "Loans": "Dluhy",
          "Transfers": "Převody"
        }
      },
      "user": {
        "label": {
          "deleted": "odstraněn",
          "notInTeam": "není v týmu",
          "SelectUser": "Vyberte uživatele"
        }
      }
    },
    "head": {
      "config": {
        "DisplayAdaptive": "Adaptivní",
        "DisplayAlways": "Vždy",
        "DisplayExtraColumns": "Zvolte podmínky pro výstup dalších sloupců.",
        "DisplayNever": "Nikdy",
        "Title": "Nastavení tabulky"
      },
      "label": {
        "CategoryDescription": "Kategorie, Popis",
        "Remain": "Zůstatek"
      }
    }
  },
  "transferJoin": {
    "button": {
      "Join": "Sloučit do převodu"
    },
    "message": {
      "ChooseCommissionCategory": "Uveďte prosím kategorii pro vytvoření výdaje - komise:",
      "ThisCanBeDoneWithCommission": "To může být provedeno, pokud vytvoříte výdajovou transakci komise ve výši <1>{sum}</1>.",
      "YouAreGoingToJoinWhat": "Chcete kombinovat transakce s různými částkami:"
    }
  },
  "unconfirmed": {
    "EndTitle": "Běžné transakce",
    "Title": "Nepotvrzené transakce"
  }
}
